{
  "schemaVersion": "shockaudit-screen02-generalization-benchmark-v1",
  "benchmarkId": "screen02-cross-domain-v1",
  "frozen": true,
  "productionImportForbidden": true,
  "reviewedAt": "2026-09-03T00:00:00.000Z",
  "cases": [
    { "scopeId": "us-video-games-2014", "population": "Public firms", "industry": "Video gaming", "geography": "United States", "studyPeriod": "2014–2022", "eventFamily": "Regulation", "outcomeFamily": "Profitability", "candidateId": "fixture-gaming-platform-rule", "expectedMaximumClass": "direct", "expectedExclusion": null, "rationale": "Official text directly names video-game publishers and a material compliance change.", "sourceIds": ["fixture-official-gaming-1"], "candidateInput": { "title": "Interactive entertainment publisher compliance rule", "industryEvidence": "video gaming and video-game publishers", "affectedPopulation": "Public firms" }, "reviewedAt": "2026-09-03T00:00:00.000Z" },
    { "scopeId": "us-video-games-2014", "population": "Public firms", "industry": "Video gaming", "geography": "United States", "studyPeriod": "2014–2022", "eventFamily": "Regulation", "outcomeFamily": "Profitability", "candidateId": "fixture-gaming-app-store-rule", "expectedMaximumClass": "adjacent", "expectedExclusion": null, "rationale": "Official text establishes a changed app-store distribution activity, while exact video-game coverage remains unverified.", "sourceIds": ["fixture-official-app-store-1"], "candidateInput": { "title": "Mobile application distribution operating rule", "industryEvidence": "public firms using app store distribution", "affectedPopulation": "Public firms" }, "reviewedAt": "2026-09-03T00:00:00.000Z" },
    { "scopeId": "us-video-games-2014", "population": "Public firms", "industry": "Video gaming", "geography": "United States", "studyPeriod": "2014–2022", "eventFamily": "Regulation", "outcomeFamily": "Profitability", "candidateId": "fixture-medicare-medicaid-provider-rule", "expectedMaximumClass": "mismatch", "expectedExclusion": "industry-mismatch", "rationale": "A Medicare and Medicaid provider-program rule does not establish a source-backed bridge to video gaming.", "sourceIds": ["fixture-official-health-programs-1"], "candidateInput": { "title": "Medicare and Medicaid provider enrollment rule", "industryEvidence": "hospitals, clinicians, and Medicare and Medicaid providers", "affectedPopulation": "Covered organizations" }, "reviewedAt": "2026-09-03T00:00:00.000Z" },
    { "scopeId": "thai-food-processors", "population": "Food-processing establishments", "industry": "Packaged food manufacturing", "geography": "Thailand", "studyPeriod": "2012–2021", "eventFamily": "Regulation", "outcomeFamily": "Productivity", "candidateId": "fixture-thai-food-label-rule", "expectedMaximumClass": "direct", "expectedExclusion": null, "rationale": "The official instrument directly covers packaged-food processors and labeling operations.", "sourceIds": ["fixture-thai-gazette-1"], "candidateInput": { "title": "Packaged-food labeling operations rule", "industryEvidence": "packaged food manufacturing and food processors", "affectedPopulation": "Food-processing establishments" }, "reviewedAt": "2026-09-03T00:00:00.000Z" },
    { "scopeId": "uk-financial-services", "population": "Regulated firms", "industry": "Financial services", "geography": "United Kingdom", "studyPeriod": "2010–2020", "eventFamily": "Regulation", "outcomeFamily": "Risk", "candidateId": "fixture-uk-capital-rule", "expectedMaximumClass": "direct", "expectedExclusion": null, "rationale": "The official source names regulated financial firms and changes capital obligations.", "sourceIds": ["fixture-uk-official-1"], "candidateInput": { "title": "Financial-services capital obligations rule", "industryEvidence": "financial services", "affectedPopulation": "Regulated firms" }, "reviewedAt": "2026-09-03T00:00:00.000Z" },
    { "scopeId": "nordic-utilities", "population": "Electricity producers", "industry": "Energy and utilities", "geography": "Denmark, Finland, Norway, and Sweden", "studyPeriod": "2008–2019", "eventFamily": "Regulation", "outcomeFamily": "Investment", "candidateId": "fixture-nordic-grid-code", "expectedMaximumClass": "direct", "expectedExclusion": null, "rationale": "Official grid-code passages name electricity producers and investment-relevant duties.", "sourceIds": ["fixture-nordic-official-1"], "candidateInput": { "title": "Electricity-producer grid investment code", "industryEvidence": "energy and utilities", "affectedPopulation": "Electricity producers" }, "reviewedAt": "2026-09-03T00:00:00.000Z" },
    { "scopeId": "canada-health", "population": "Hospitals", "industry": "Healthcare", "geography": "Canada", "studyPeriod": "2011–2020", "eventFamily": "Regulation", "outcomeFamily": "Quality", "candidateId": "fixture-canada-hospital-reporting", "expectedMaximumClass": "direct", "expectedExclusion": null, "rationale": "The official rule directly names hospitals and imposes a substantive reporting change.", "sourceIds": ["fixture-canada-official-1"], "candidateInput": { "title": "Hospital quality-reporting rule", "industryEvidence": "healthcare and hospitals", "affectedPopulation": "Hospitals" }, "reviewedAt": "2026-09-03T00:00:00.000Z" },
    { "scopeId": "brazil-cloud-platforms", "population": "Digital-platform firms", "industry": "Cloud software and digital platforms", "geography": "Brazil", "studyPeriod": "2013–2023", "eventFamily": "Regulation", "outcomeFamily": "Innovation", "candidateId": "fixture-brazil-data-rule", "expectedMaximumClass": "direct", "expectedExclusion": null, "rationale": "Official source facts explicitly name cloud software and digital-platform activity, so direct classification is warranted.", "sourceIds": ["fixture-brazil-official-1"], "candidateInput": { "title": "Cloud-platform operating data rule", "industryEvidence": "cloud software and digital platforms", "affectedPopulation": "Digital-platform firms" }, "reviewedAt": "2026-09-03T00:00:00.000Z" },
    { "scopeId": "kenya-logistics", "population": "Freight operators", "industry": "Cold-chain logistics", "geography": "Kenya", "studyPeriod": "2015–2024", "eventFamily": "Regulation", "outcomeFamily": "Operating cost", "candidateId": "fixture-kenya-cold-chain-standard", "expectedMaximumClass": "direct", "expectedExclusion": null, "rationale": "The source directly names cold-chain freight operators and temperature-control obligations.", "sourceIds": ["fixture-kenya-official-1"], "candidateInput": { "title": "Cold-chain freight temperature standard", "industryEvidence": "cold-chain logistics", "affectedPopulation": "Freight operators" }, "reviewedAt": "2026-09-03T00:00:00.000Z" },
    { "scopeId": "chile-copper-disaster", "population": "Copper mines", "industry": "Mining", "geography": "Chile", "studyPeriod": "2009–2018", "eventFamily": "Disaster", "outcomeFamily": "Output", "candidateId": "fixture-chile-earthquake", "expectedMaximumClass": "direct", "expectedExclusion": null, "rationale": "The frozen official source facts explicitly name the mining population and retain a bounded mine-location exposure variable.", "sourceIds": ["fixture-hazard-1", "fixture-mines-1"], "candidateInput": { "title": "Copper-mining region earthquake", "industryEvidence": "mining and copper mines", "affectedPopulation": "Copper mines" }, "reviewedAt": "2026-09-03T00:00:00.000Z" },
    { "scopeId": "global-all-industries", "population": "Listed firms", "industry": "All industries", "geography": "Global", "studyPeriod": "2000–2024", "eventFamily": "Disaster", "outcomeFamily": "Survival", "candidateId": "fixture-global-earthquake", "expectedMaximumClass": "broad", "expectedExclusion": null, "rationale": "A location-linked official hazard may remain broad for a genuinely all-industry scope.", "sourceIds": ["fixture-global-hazard-1"], "candidateInput": { "title": "Global earthquake event record", "industryEvidence": "cross-industry location exposure", "affectedPopulation": "Listed firms" }, "reviewedAt": "2026-09-03T00:00:00.000Z" },
    { "scopeId": "germany-robotics", "population": "Robotics suppliers", "industry": "Collaborative industrial robotics", "geography": "Germany", "studyPeriod": "2014–2022", "eventFamily": "Regulation", "outcomeFamily": "Employment", "candidateId": "fixture-generic-online-rule", "expectedMaximumClass": "mismatch", "expectedExclusion": "industry-mismatch", "rationale": "Generic online, company, and consumer terms cannot create an adjacent robotics match.", "sourceIds": ["fixture-unrelated-online-1"], "candidateInput": { "title": "Generic online consumer-service rule", "industryEvidence": "online companies, providers, platforms, and consumers", "affectedPopulation": "Covered organizations" }, "reviewedAt": "2026-09-03T00:00:00.000Z" },
    { "scopeId": "japan-fisheries", "population": "Commercial fleets", "industry": "Pelagic fisheries", "geography": "Japan", "studyPeriod": "2005–2018", "eventFamily": "Regulation", "outcomeFamily": "Catch volume", "candidateId": "fixture-japan-quota-rule", "expectedMaximumClass": "direct", "expectedExclusion": null, "rationale": "Official quota text directly identifies the fleet population and regulated fishing activity.", "sourceIds": ["fixture-japan-official-1"], "candidateInput": { "title": "Pelagic-fisheries fleet quota rule", "industryEvidence": "pelagic fisheries", "affectedPopulation": "Commercial fleets" }, "reviewedAt": "2026-09-03T00:00:00.000Z" },